### ISSUE TITLE
eSIM profile switch to non-primary profile causes permanent PDP context activation failure and interface lockout in ifdown state

### ISSUE THREAD

**Issue by xsetiadi** [ddimension/wwand#35]
**Environment:**
- Modem: Fibocom FM350-GL (firmware `81600.0000.00.29.23.24`)
- Host: OpenWrt-based router (H29K)
- wwand version: [1.6.7_p21]
- SIM setup: Physical SIM (XL), eSIM profile 1 (XL – ICCID `8962112181029221344`), eSIM profile 2 (Smartfren – ICCID `89620940251000135468`)
- Network: XL / Smartfren (merged as XLSmart, PLMN 510/11)

**Steps to Reproduce:**
1. Start with the modem connected and working on the physical SIM or eSIM XL profile.
2. Use the modem tool page to switch the eSIM profile to Smartfren (`89620940251000135468`).
3. Observe wwand attempts to connect. The modem registers on the network but PDP context activation fails.
4. Switch back to the XL eSIM profile or the physical SIM.
5. Attempt to bring the interface up manually or via APN change.
6. Delete and re-add the modem in the configuration.
7. Reboot the router and delete/re-add the modem again to get internet again.

**Expected Behavior:**
- After switching eSIM profiles, wwand should correctly detect the new ICCID/IMSI, reconfigure the PDP context, and establish a data connection.
- Switching back to a previously working profile (XL eSIM or physical SIM) should restore connectivity without requiring a reboot.

**Actual Behavior:**
- After enabling the Smartfren eSIM profile, the modem registers (`+CREG: 6,"2331"...`, `+CEREG: 1,"73A9"...`) but `AT+CGACT=1,1` returns `ERROR`.
- wwand retries connection 13 times (`connection attempt 1..13 failed`), then sets the interface to `ifdown`.
- The interface remains administratively down even when switching back to the XL eSIM or physical SIM. wwand logs: `interface fm350 is administratively down (ifdown), leaving it alone`.
- The modems configuration continues to show the old ICCID (XL) instead of the Smartfren one.
- Errors `config: interface fm350 references unknown modem 'wwmodem0'` and `connection failed: no_such_context` appear.
- Only a full reboot followed by deleting and re-adding the modem restores connectivity.

**Key Log Excerpts:**

```
18:44:57 daemon.notice wwand[1801]: modem wwmodem0: esim[enable]: result: code=0 success
18:44:57 daemon.notice wwand[1801]: modem wwmodem0: eSIM profile 89620940251000135468 enabled (lpac)
18:45:00 daemon.debug wwand[1801]: modem wwmodem0: urc[at]: +CREG: 6,"2331","004790D85",7,0,0
18:45:00 daemon.debug wwand[1801]: modem wwmodem0: urc[at]: +CEREG: 1,"73A9","04790D85",7,0,0
18:45:10 daemon.warn wwand[1801]: modem wwmodem0: at: AT+CGCONTRDP=1 -> error: ERROR
18:45:10 daemon.debug wwand[1801]: modem wwmodem0: at: AT+CGACT? ->
18:46:25 daemon.warn wwand[1801]: modem wwmodem0: at: AT+CGACT=1,1 -> error: ERROR
18:46:25 daemon.err wwand[1801]: interface fm350: bring-up failed: { "stage": "connect", "err": { "error": "ERROR" } }
18:46:25 daemon.info wwand[1801]: modem wwmodem0: connection attempt 1 failed
...
18:47:49 daemon.warn wwand[1801]: config: interface fm350 references unknown modem 'wwmodem0'
18:48:02 daemon.notice netifd: Interface 'fm350_6' is disabled
18:48:02 daemon.notice netifd: Interface 'fm350' is now down
18:48:03 daemon.notice netifd: fm350 (8686): connection failed: no_such_context
...
18:49:21 daemon.notice wwand[1801]: modem wwmodem0: eSIM profile 8962112181029221344 enabled (lpac)  // back to XL
18:49:24 daemon.notice wwand[1801]: modem wwmodem0: sim reapply: iccid 8962112181029221344 imsi 510118102922134
18:49:57 daemon.notice wwand[1801]: interface fm350 is administratively down (ifdown), leaving it alone
18:51:31 daemon.notice wwand[1801]: modem wwmodem0: switched to SIM slot 1  // physical SIM
18:52:41 daemon.notice wwand[1801]: interface fm350 is administratively down (ifdown), leaving it alone
18:53:45 daemon.warn wwand[1801]: modem wwmodem0: at: AT+CCHO="A0000005591010FFFFFFFF8900000100" -> error: ERROR
18:53:45 daemon.warn wwand[1801]: modem wwmodem0: at: AT+QESIM="profile_brief" -> error: ERROR
```

**Additional Observations:**
- The Smartfren profile appears to register successfully, so the failure is likely at the PDP context layer (APN, IP version, or bearer configuration mismatch).
- wwand does not refresh the interface configuration (ICCID/IMSI) after the eSIM profile switch until a manual APN save or config reload.
- Once the interface is set to `ifdown`, wwand refuses to bring it back up even when the modem becomes ready again. This suggests a state management bug where the `ifdown` flag is not cleared on subsequent profile changes or modem re-initialization.
- The `unknown modem 'wwmodem0'` warnings may indicate a race condition between wwand's internal modem object and the netifd interface configuration.

**Impact:**
- Users cannot switch between eSIM profiles without risking a complete loss of connectivity that requires a reboot and manual modem re-addition.
- The modem becomes unusable until the router is rebooted, which is unacceptable for remote or headless deployments.

**Request:**
Please investigate:
1. Why `AT+CGACT=1,1` fails after switching to the Smartfren eSIM profile even though registration succeeds.
2. Why wwand sets the interface to `ifdown` and never recovers, even after switching back to a working profile.
3. Why the interface configuration does not update to the new ICCID/IMSI after an eSIM profile switch despite im still leave sim slot to 0.
4. The `unknown modem 'wwmodem0'` warnings and their relation to the interface state.

A fix should ensure that after an eSIM profile switch, wwand fully re-evaluates the modem state, updates the interface configuration, and allows recovery without a reboot.

log for further investigation is here

[wwand-switch-test-19-09-pt2.log](https://github.com/user-attachments/files/32414777/wwand-switch-test-19-09-pt2.log)

**Comment by ddimension** [comment]
Thank you for splitting this out of #32 and for the full log — it answers three of your four questions outright, and two of them differently than you expected.

## 3. The ICCID *was* refreshed

This one is the easiest to settle, and your own log does it:

```
18:44:57  eSIM profile 89620940251000135468 enabled (lpac)
18:45:00  sim reapply: iccid 89620940251000135468 imsi 510118102922134
18:45:0x  ncm modem FM350-GL …, imsi 510098001596219, iccid 89620940251000135468
```

wwand re-read the card and picked up both the new ICCID and the new IMSI. What does **not** change is the uci config, and that is deliberate: wwand never rewrites an interface's APN because a card was swapped underneath it. The mechanism for "this card needs different settings" is a separate section — see below.

(One cosmetic wart: the `sim reapply` line prints the new ICCID beside the *old* IMSI, because it is logged between the two reads. The identity line a moment later has both right. I will fix the ordering.)

## 4. "unknown modem" is not a race

```
18:47:49  config: interface fm350 references unknown modem 'wwmodem0'
18:47:49  modem wwmodem0: state READY -> ABSENT
18:48:02  netifd: Interface 'fm350' is now down
```

That warning is literal: at that moment the config had no `wwmodem0` section, because you had just deleted the modem. The interface still pointed at it, so there was nothing to drive it and netifd took it down. Cause and effect, not a race between wwand and netifd.

## 2. The lockout — and it was not wwand that downed it

This is the part worth understanding, because the recovery is one command rather than a reboot.

wwand did not take the interface down. netifd did, at 18:48:02, as the direct consequence of the config edit above. From then on the interface carries `autostart = false`, which is exactly what an operator's `ifdown` leaves behind — and wwand deliberately refuses to override that (`daemon.uc:400`). That guard exists because the opposite behaviour was a real bug: wwand used to resurrect interfaces people had deliberately taken down (reproduced on a Cudy LT300, 2026-08-23).

So it is not stuck. **`ifup fm350` brings it back**, no reboot and no re-adding the modem:

```
ifup fm350
```

wwand does recognise and undo its *own* downs — there is a marker for that, valid for three minutes — but this down was not one of them.

Whether a **card change** should clear that latch is a fair question and I am thinking about it. The argument for: you did not decide to keep this interface down, a profile switch did. The argument against: an operator who runs `ifdown` and then changes a SIM would be surprised to find the link back up. I would rather get that right than quickly.

## 1. Why CGACT fails — and one hypothesis I can already rule out

I checked whether wwand skipped re-programming the context after the switch. It did not, and it cannot: the "already configured" path reads `AT+CGDCONT?` **from the modem** and compares the real answer (`context_ncm.uc:760`), so the context on the modem genuinely matched what was asked for. Your log shows what was asked:

```
18:48:17  apn "internet", pdp-type ipv4v6
18:48:17  cid 1 already configured (pdp-type + apn match) — skipping context write
          AT+CGACT=1,1 -> ERROR
```

So the modem accepted the definition and the network refused to activate it. That is the shape of a **wrong APN for that profile** — wwand programmed `internet` because that is what the *interface* says, and it says the same thing for both cards. Smartfren is very unlikely to want XL's APN.

The feature for exactly this is a per-SIM override, matched by ICCID:

```
config wwand_sim
	option iccid '89620940251000135468'
	option apn   '<the Smartfren APN>'
	# option auth / username / password if that profile needs them
```

It overrides the interface's apn/auth whenever that card is the active one, and changes nothing for the XL profile. That is the first thing I would try.

If a corrected APN still fails, the capture that settles it is taken while the Smartfren profile is active:

```
wwandctl at 'AT+CGDCONT?'
wwandctl at 'AT+CGACT=1,1'
wwandctl at 'AT+CEER'
```

`AT+CEER` is the one that matters — it gives the network's reject cause in plain text where `CGACT` only says ERROR, and wwand already uses it for registration diagnostics. A cause like "missing or unknown APN" would confirm the above; "service option not subscribed" would mean the profile is not provisioned for data at all, which is the provider's side and nothing wwand can fix.

## What I will change

Nothing yet on the lockout — I want to think about the latch rather than trade one surprise for another. The `sim reapply` log ordering I will fix. If the APN override solves your case, say so and I will make the failure message name it: "context activation refused by the network — if this card needs a different APN, see wwand_sim" is a great deal more useful than `ERROR`.

**Comment by xsetiadi** [comment]
Thanks for the detailed breakdown — the `wwand_sim` APN override did exactly what you said. I've now tested the full flow again on a clean boot with the override in place and can confirm the core issue is resolved. Two things still remain in the same switch flow.

### APN override works

Configured `wwand_sim` for `89620940251000135468` with `option apn 'smartfren4g'` (no auth, no `pdp_type`). wwand now connects on the Smartfren eSIM with the correct APN, gets a Smartfren IP (`10.115.13.124`), and Smartfren DNS (`10.46.50.50 / 10.45.50.50`). The `sim reapply` line also now prints the correct IMSI (`510118102922134`), so the cosmetic fix landed. Removing the auth lines cleared the `AT+MGAUTH` / `AT+CGAUTH` errors — Smartfren doesn't need them here.

### 1. First `AT+CGACT=1,1` after APN rewrite always fails; second attempt 2 s later succeeds

```
23:13:45 AT+CGDCONT=1,"IPV4V6","smartfren4g" ok
23:13:45 AT+CGACT=1,1 -> error: ERROR
23:13:45 bring-up failed: { "stage": "connect", "err": { "error": "ERROR" } }
23:13:45 connection attempt 1 failed
23:13:47 AT+CGDCONT? -> +CGDCONT: 1,"IPV4V6","smartfren4g","",,,,,
23:13:47 cid 1 already configured (pdp-type + apn match) — skipping context write
23:13:47 urc[at]: +CGEV: ME PDN ACT 1
23:13:47 AT+CGACT=1,1 ->
23:13:47 AT+CGPADDR=1 -> +CGPADDR: 1,"10.115.13.124",""
```

The APN rewrite succeeds, but the immediate `CGACT` fails and only the retry 2 s later works. Looks like a race with the modem's context state settling after the rewrite.

### 2. `fm350_6` DHCPv6 subinterface never establishes on Smartfren

```
23:13:47 dhcpv6 subinterface fm350_6: reload + down/up for the v6-capable context
23:13:47 netifd: fm350_6 (5256): Failed to send RS (Network unreachable)
23:13:47 netifd: fm350_6 (5256): wwand0: error connecting LLA socket
23:13:48 avahi-daemon: Joining mDNS multicast group on interface wwand0.IPv6 with address fe80::200:11ff:fe12:1314
```

The subinterface reload fires before `wwand0` has its link-local address. The RS goes out with no source address and fails. The LLA appears a second later (avahi joins at `23:13:48`), but the subinterface has already given up.

For comparison, on the XL eSIM profile the same hardware establishes `fm350_6` normally and it appears in `/tmp/resolv.conf.d/resolv.conf.auto` with the XL IPv6 DNS servers. On Smartfren it never does — the main `fm350` interface still gets IPv6 DNS from the PDP context (`2402:5680:840:1:21::5050`), but the subinterface never comes up and `odhcpd` keeps logging `No default route present, setting ra_lifetime to 0!`.

### What's working

Registration, PDP activation (after the retry), IPv4 data, DNS. The DNS issue I mentioned earlier was client-side stale state, not wwand — I've ruled that out. No interface lockout this time either; `ifup fm350` wasn't needed.

### Possible directions

- **#1:** after rewriting the PDP context, either retry `CGACT` once before declaring failure or add a short settle delay.
- **#2:** don't trigger the `fm350_6` reload until `wwand0` has a link-local address, or retry RS/SOLICIT on the subinterface after the parent's IPv6 address appears.

Happy to provide more logs if either needs a narrower repro.

**Comment by xsetiadi** [comment]
Follow-up with additional evidence for the fm350_6 issue. I've attached the full pt6 debug log as a file.

[wwand-switch-test-19-09-pt6.log](https://github.com/user-attachments/files/32418988/wwand-switch-test-19-09-pt6.log)

To reinforce the impact, here is the A/B comparison from /tmp/resolv.conf.d/resolv.conf.auto on the same hardware after a clean boot:

On XL eSIM profile (working):

```text
# Interface fm350
nameserver 112.215.198.248
nameserver 112.215.198.254
nameserver 2400:9800:2:2::245
nameserver 2400:9800:2:2::246
# Interface fm350_6
nameserver 2400:9800:2:2::245
nameserver 2400:9800:2:2::246
```

On Smartfren eSIM profile (broken):

```text
# Interface fm350
nameserver 10.46.50.50
nameserver 10.45.50.50
nameserver 2402:5680:840:1:21::5050
```

As you can see, when fm350_6 fails to establish, the # Interface fm350_6 section is completely absent from the resolver configuration. The main interface still gets IPv6 DNS from the PDP context, but the subinterface provides nothing. This confirms the failure isn't just a cosmetic log warning — it has a direct, measurable impact on the system's IPv6 DNS configuration.

**Comment by ddimension** [comment]
That A/B against `resolv.conf.auto` is the right kind of evidence, and the pt6 log names the cause. It is not the APN and it is not the Smartfren profile — it is a race in wwand's own handling of the v6 subinterface, and your profile switch only triggers it by changing the IPv4 address.

## What pt6 shows, in order, inside one second

```
23:13:47.3554  DELADDR — fe80::200:11ff:fe12:1314 is REMOVED from wwand0
23:13:47       wwand: interface fm350: ipv4 config: 10.115.13.124/32   (was 10.147.161.73)
23:13:47       wwand: dhcpv6 subinterface fm350_6: reload + down/up
23:13:47       netifd: Interface 'fm350_6' is now down
23:13:47       netifd: Interface 'fm350_6' is setting up now
23:13:47       fm350_6 (5256): Failed to send RS (Network unreachable)
23:13:47       fm350_6 (5256): wwand0: error connecting LLA socket
23:13:47       avahi:  Registering fe80::200:11ff:fe12:1314          ← the LLA comes BACK
```

Applying the new IPv4 settings to `fm350` takes the device's IPv6 **link-local** address away for a moment. wwand's down/up of `fm350_6` lands inside exactly that gap, so odhcp6c starts on a device with no link-local address: it cannot open the LLA socket, its Router Solicitation goes nowhere, and — this is the part that makes it permanent — **it never tries again**. After 23:13:47 the string `fm350_6` does not appear in your log once, and it runs for another eight minutes.

The LLA is back a fraction of a second later. Nothing is wrong with the modem, the profile, or the APN. wwand simply asked netifd to start v6 at the one instant the device could not carry it.

That also explains the shape you saw earlier and could not place: on the XL profile the address often does not change, so there is no DELADDR, so no gap, so v6 comes up. It looked profile-dependent because the address change is profile-dependent.

## Why your resolv.conf looks the way it does

It follows exactly: `fm350` keeps the IPv6 **DNS servers**, because those come from the PDP context over `AT+CGCONTRDP` and wwand publishes them on the parent (`ipv6 dns: [2402:5680:840:1:21::5050]` in your log). `fm350_6` contributes nothing, because odhcp6c on it never got off the ground. So you see IPv6 nameservers and no IPv6 connectivity — which is worse than having neither, and you are right that it is not cosmetic.

## The fix, and why I am not shipping it blind

The deterministic repair is for wwand to wait for a link-local address on the parent device before issuing that `up`, instead of firing the chain immediately. I do not want to guess at it: `deps.uc`, where that chain lives, is deliberately a thin ubus/uci layer with no filesystem access, and a timing fix for hardware I cannot reproduce on is exactly the kind of change that looks right and is not.

**One command settles the mechanism**, run while the broken state is live:

```
ip -6 addr show dev wwand0
```

- If you see a `fe80::…` **and** `fm350_6` is still dead, it confirms the above: the address is there now, it was missing at the wrong moment, and odhcp6c never retried.
- If there is **no** `fe80::…` at all, the LLA never came back and the cause is a step earlier — a different bug, and one I would want to see.

And the workaround until then, which should restore v6 immediately without touching the profile:

```
ifup fm350_6
```

If that brings the `# Interface fm350_6` block back into `resolv.conf.auto`, it confirms the diagnosis outright — a second attempt succeeds because the link-local address is present by then.

Tell me which of the two you see and I will build the wait against it.

**Comment by xsetiadi** [comment]
Full capture over ~2 minutes on the Smartfren profile. Six packets, zero responses:

```text
$ ip -6 addr show dev wwand0
3: wwand0: <BROADCAST,MULTICAST,NOARP,UP,LOWER_UP> mtu 1500 qdisc fq_codel state UNKNOWN group default qlen 1000
    inet6 fe80::200:11ff:fe12:1314/64 scope link proto kernel_ll
       valid_lft forever preferred_lft forever
```

LLA present throughout. Then:

```text
$ tcpdump -i wwand0 -n -w /tmp/v6.pcap 'ip6'
^C6 packets captured

$ tcpdump -r /tmp/v6.pcap
00:32:32.876003 IP6 fe80::200:11ff:fe12:1314 > ip6-allrouters: ICMP6, router solicitation, length 16
00:32:36.475846 IP6 fe80::200:11ff:fe12:1314.546 > ff02::1:2.547: dhcp6 solicit
00:33:07.435992 IP6 fe80::200:11ff:fe12:1314 > ip6-allrouters: ICMP6, router solicitation, length 16
00:33:12.286158 IP6 fe80::200:11ff:fe12:1314.546 > ff02::1:2.547: dhcp6 solicit
00:34:19.116003 IP6 fe80::200:11ff:fe12:1314 > ip6-allrouters: ICMP6, router solicitation, length 16
00:34:25.297428 IP6 fe80::200:11ff:fe12:1314.546 > ff02::1:2.547: dhcp6 solicit
```

odhcp6c is retransmitting with exponential backoff (35 s, then 67 s), and the kernel is retrying RS on the same cadence. Neither gets any reply — no RA, no DHCPv6 ADVERTISE. Same modem, same RNDIS path, same host: on the XL profile IPv6 works end-to-end via SLAAC.

This retires my earlier "stuck in pending" concern — the pending: true state was just odhcp6c sitting inside its retry window. No netifd-side bug there.

Final picture:

LLA race — real and worth fixing. The DELADDR/ADD window kills the first RS/SOLICIT of a fresh transition on carriers where the IPv4 address changes.

Smartfren PDP context provides no IPv6 service. The RS and SOLICIT go out and are ignored. Network-side, not wwand. The IPv6 DNS in AT+CGCONTRDP (2402:5680:840:1:21::5050) appears to be PDP metadata not backed by an actual IPv6 data path on this APN.

Suggested directions:

Fix 1 as planned — wait for the LLA on the parent before firing fm350_6 up.

Add an IPv4-only PDP option — the LuCI UI already exposes "IPv4" in the PDP type dropdown. Backing that with a real UCI/proto option would skip fm350_6 entirely on carriers without IPv6.

Fail-fast on no DHCPv6 response — optional, low priority given the root cause is network-side.

I didn't capture a wwand debug log during this tcpdump window (the previous pt6 log ends ~50 min earlier). If you'd like one correlated with the IPv6 traffic, say the word and I'll re-run and attach it.

**Comment by ddimension** [comment]
That capture settles it, and it settles it against my diagnosis as much as for it. Thank you for running it properly rather than taking my word.

**The LLA was never the reason this stayed broken.** It is present throughout, the RS and the SOLICIT go out, they retransmit with proper backoff, and nothing answers. Six packets, zero replies. The Smartfren APN gives you no IPv6 data path — the `2402:5680:840:1:21::5050` in `AT+CGCONTRDP` is PDP metadata with nothing behind it, exactly as you say. Network-side, and nothing wwand can dial its way out of.

So: the race I described is real, but it costs you the *first* attempt, not the connection. On a carrier that answers, odhcp6c's retry covers it — which is why nobody had seen it. I am fixing it anyway, because losing the first RS is a slow start nobody should pay for, and your log is the only evidence it exists.

## Your suggestion 2 already exists — it is the dropdown you are looking at

> Add an IPv4-only PDP option — the LuCI UI already exposes "IPv4" in the PDP type dropdown. Backing that with a real UCI/proto option would skip fm350_6 entirely.

It is backed. Selecting **IPv4** writes the canonical `option pdp_type 'ipv4'` (`luci-proto-wwand/…/wwand.js:480`), and that is the very flag the subinterface is gated on:

```
if (deps.ensure_wan6 && … && ctx.config?.pdp_type != 'ipv4') {
```
`daemon.uc:851`

So on the Smartfren profile, setting the PDP type to IPv4 does both halves of what you want: the attach is requested IPv4-only (`context_ncm.uc:647` puts it into CGDCONT), and `fm350_6` is never created, so there is no odhcp6c to sit there soliciting a network that will not answer. No code change needed — try it and your `resolv.conf.auto` should stop advertising an IPv6 nameserver you cannot reach.

**One caveat before you switch every interface over.** The dropdown's own help says it, and it is not theoretical: some subscriptions reject an IPv4-only attach outright (EMM cause 33). If Smartfren is one of those, you will trade a dead v6 path for no attach at all — in which case `ipv4v6` plus your suggestion 3 is the right shape, and I would want to know.

## What I am taking from this

1. **The LLA race** — fixing. The subinterface must not be brought up while the parent has no link-local address; your DELADDR/ADD window is the proof it can happen.
2. **`pdp_type 'ipv4'`** — no change, already there. If it did not occur to you from the UI, that is a documentation problem and I will say plainly in the PDP-type help that IPv4 also suppresses the v6 subinterface.
3. **Fail-fast on no DHCPv6 response** — I agree with your own ranking: low priority, and it would have to be careful. A network that is merely slow to send an RA looks identical to one that never will, for the first minute.

No need to re-run with a correlated wwand log. The tcpdump answered the question the log would have.

**Comment by xsetiadi** [comment]
Thanks — that all makes sense. Back on the XL eSIM as my daily driver since the bank login requires IPv6 and IPv4-only isn't viable long-term.

A couple of observations from the IPv4-only test:

pdp_type on wwand_sim is silently ignored. I tried setting it in the per-ICCID override for the Smartfren profile:

```text
network.@wwand_sim[0].iccid='89620940251000135468'
network.@wwand_sim[0].apn='smartfren4g'
network.@wwand_sim[0].pdp_type='ipv4'

log: config: wwand_sim cfg08228e: unknown option 'pdp_type' (ignored)
AT+CGDCONT? -> +CGDCONT: 1,"IPV4V6","smartfren4g","",,,,,,,,,,
```

So it only works when set on the interface (network.fm350), which is global — it would force XL to IPv4-only as well, losing working IPv6 on that profile. Since the whole point of wwand_sim is per-SIM config (APN, auth, PIN), would you consider adding pdp_type to that schema too? Two SIMs, two carriers, one needs IPv6, the other doesn't — the current global-only knob can't express that.

Downstream symptom worth knowing about. While testing Smartfren IPv4-only, Android clients worked but Linux clients failed DNS. Root cause turned out to be the combination of odhcpd emitting ra_lifetime=0 on br-lan (because wwand correctly has no IPv6 default route on the Smartfren context) and Tailscale MagicDNS on the Linux client pointing DNS at the router's IPv6 DNS first. The client tries IPv6 DNS, gets nowhere, and doesn't fall back to IPv4 cleanly. Not a wwand bug — just context that the ra_lifetime=0 behavior has real client-side effects beyond log noise. If you ever consider suppressing the IPv6 DNS from AT+CGCONTRDP when there's no IPv6 default route, that would prevent this class of failure entirely.

No action needed on that last point. Happy to test the LLA fix whenever you have something ready.

im also plan to add another esim from anothe provider. smartfren is my backup plan when 5G arrive because it is provide reasonable price.

while now im using XL as my main provider. i will try to add im3 tomorrow. it is different provider. i just curious about esim profile testing im doing right now.

**Comment by xsetiadi** [comment]
Third data point: bought an IM3 (Indosat) eSIM and tested on the same FM350-GL. Same result as Smartfren — IPv4 works, IPv6 does not.

**IM3 PDP context:**
```
$ wwandctl at 'AT+CGCONTRDP=1'
+CGCONTRDP: 1,6,"indosatgprs.MNC001.MCC510.GPRS","","","10.19.19.244","114.7.173.220","","",0,,0,,,,,,,,,,,,0

$ wwandctl at 'AT+CGPADDR=1'
+CGPADDR: 1,"10.143.91.164",""
```

Note: unlike Smartfren, IM3 doesn't even return an IPv6 DNS in the metadata — the IPv6 fields are entirely empty. So the host has no IPv6 DNS at all, not just a bogus one.

**tcpdump on wwand0, ~60s:**
```
02:26:43.600215 IP6 fe80::200:11ff:fe12:1314 > ff02::2: ICMP6, router solicitation, length 16
 02:26:51.046974 IP6 fe80::200:11ff:fe12:1314.546 > ff02::1:2.547: dhcp6 solicit
 2 packets captured
```

Exactly one RS and one SOLICIT, zero replies. Same as Smartfren.

Summary across three carriers on the same hardware, firmware, RNDIS path, and host:

| Carrier | IPv6 from network | `fm350_6` |
|---|---|---|
| XL | Yes (SLAAC works) | Comes up |
| Smartfren | No | Pending, never completes |
| IM3 | No | Pending, never completes |

So this isn't Smartfren-specific — it's the common case in this market. XL appears to be the exception, not the rule.

**Two implications:**

1. **The IPv4-only PDP option should probably be a first-class setting**, not a hidden dropdown, and ideally per-SIM through `wwand_sim`. Two of three carriers here don't offer IPv6, so users on either would benefit from the option to skip the `fm350_6` bring-up entirely. It would also avoid the CachyOS/Tailscale DNS hang I mentioned earlier — no v6 subinterface, no v6 DNS in resolv.conf, no problem.

2. **The LLA race fix is still valuable**, but it doesn't change the outcome on these carriers — even with the race eliminated, there's no IPv6 service to reach. The race fix matters for XL and any carrier that actually answers.

Happy to test any of this if it helps. Back on XL as daily driver for now.

**Comment by ddimension** [comment]
Three data points across three carriers is a much stronger argument than one, and it changes what the answer should be. Thank you for going and buying an IM3 eSIM to test it.

**`pdp_type` on `wwand_sim` — you read the log correctly, and the reason is exactly what it looks like.**

The parser has an explicit allow-list and `pdp_type` is not on it:

```
SIM_KNOWN_OPTS = [ 'modem', 'iccid', 'imsi', 'pincode', 'apn', 'auth',
                   'username', 'password', 'plmn_list' ]      (config.uc)
```

Anything else gets the "unknown option (ignored)" warning you saw. But that is only half of it, and the other half matters for anyone tempted to work around it: even if the parser accepted the key, nothing would read it. All three backends take the PDP type from the interface section directly, not through the per-SIM resolver:

- `context.uc` reads `self.config.pdp_type` at four points (profile setup, the AT `CGDCONT` string, the type check, and the re-apply comparison)
- `context_mbim.uc` maps it to the MBIM `IpType` in one place
- `context_ncm.uc` goes through `eff_config()`, which resolves exactly `apn, auth, username, password` through the override and copies everything else — `pdp_type` included — straight from the interface

(Anchors against the current tree as of 2026-09-20; the line numbers in 1.6.7_p21 will differ slightly.)

So it is a real gap in the per-SIM model, not a deliberate restriction. The resolver itself (`context_common.conn_cfg`) is generic and would handle the field unchanged; what is missing is the schema entry and the read sites in all three backends.

Worth adding: I hit this same warning today on entirely unrelated hardware — a different modem, a different box, a different person's config — where someone had also put `pdp_type` on a `wwand_sim` and expected it to apply. Two independent people making the same assumption within a day is a good sign the assumption is the reasonable one.

I am not folding it in as a side effect of a bug-fix round, though. It touches the config schema, three backends and the documented model, and it deserves its own change with its own tests rather than riding along. Filed as its own piece of work.

**The LLA race fix is in the tree.** It does what your DELADDR/ADD window showed: the `<iface>_6` bring-up now waits for the parent's link-local address instead of landing inside the gap where it is briefly gone.

And your assessment of its scope is right — it is also what the commit says. Only the FIRST Router Solicitation is lost; your own tcpdump showed odhcp6c retransmitting with proper backoff afterwards. So it buys a faster start on carriers that answer, and changes nothing on carriers that do not. On XL it should matter; on Smartfren and IM3 it will not, for the reason you gave.

**On your table.** Two of three carriers offering no IPv6 at all is the part I had not appreciated, and it is the strongest argument for the per-SIM knob: the choice is not "does this box want IPv6" but "does this SIM's carrier have it", and those are different questions when the box holds two profiles.

On suppressing the IPv6 DNS from `AT+CGCONTRDP` when there is no IPv6 default route — I have not looked at that closely enough to say anything useful yet, so I will not promise it. Noted as context, which is how you offered it.

**Comment by ddimension** [comment]
Correction to my own comment above: I understated the scope, and the part I left out is the part that matters most to you.

I wrote "the schema entry and the read sites in all three backends". A review of that claim found three more places that read the PDP type off the interface, and one of them decides your actual outcome:

| Where | What reads it |
|---|---|
| `modem_mbim.uc` | the **attach profile** — two lines below a per-SIM lookup for username and password |
| `modem_ncm.uc` | `attach_cfg()`, which returns the interface config unfiltered and drives the autonomous LTE attach |
| `daemon.uc` | the **dynamic DHCPv6 subinterface gate** — `ctx.config?.pdp_type != 'ipv4'` |

That last one is why a partial fix would have disappointed you. Teach only the backends to honour a per-SIM `pdp_type` and a Smartfren or IM3 profile set to `ipv4` would still get an `fm350_6` child created for it — the exact thing you want gone, and the one you noticed the client-side consequences of.

So the honest scope is: the schema, three context paths, both attach paths, and the daemon's v6 orchestration. That does not change whether it should happen — your three-carrier table is a good argument that it should — but it does explain why it is not a one-line addition, and it is recorded that way now rather than as the smaller thing I first described.

**Comment by xsetiadi** [comment]
Thanks for the detailed breakdown — and for correcting your own scope estimate, that is genuinely useful. Understood on all three points:

LLA fix is in the tree. I will test it on XL (the only carrier here that answers) and confirm the first RS no longer gets lost.

Global pdp_type 'ipv4' already works. I will use it when on Smartfren/IM3 and accept losing XL's IPv6 during those periods, until per-SIM lands.

Per-SIM pdp_type is a separate piece of work. Your three-carrier table argument is exactly why it matters — glad it is recorded that way.

No action needed from me right now. I will report back if the LLA fix behaves differently on XL than expected.

**Comment by ddimension** [comment]
Nothing needed from you — one thing worth knowing before you test the LLA behaviour, because it changed again after the comment you are replying to.

`c808554` was the original fix: wait for the parent's link-local before starting the subinterface. A review of my own work found that it still checked for the address *before* the renew that takes it away, which is the original bug with a narrower window rather than a fix. `6ae4cab` corrects it — the check is now deferred a tick and the address has to be there on two **consecutive** readings, so the gap the renew opens is bracketed instead of raced.

Practically: test against `wwand 1.6.7_p46` or later. That is the version the feed is publishing now and it carries both commits. Anything earlier has only the half-fix, and on a network that answers the RS retry you would most likely see it behave correctly anyway — which is exactly why the first version stayed invisible.

The other two points stand as you have them: global `pdp_type 'ipv4'` is the working stopgap, and per-SIM `pdp_type` is recorded as its own piece of work with the scope written out.

**Comment by xsetiadi** [comment]
Re-ran the full eSIM switch sequence on the latest build, this time setting the fm350 interface to IPv4-only (pdp_type 'ipv4') to avoid the Smartfren IPv6 problem entirely. 

Sequence was: physical SIM → XL eSIM → Indosat eSIM → Smartfren eSIM → back to XL eSIM.  set the ipv4 on interface fm350 when on Smartfren eSIM and back to XL eSIM, till now.
All four registered and connected. But two new issues appeared with the IPv4-only setting:

1. pdp_type 'ipv4' still reports an IPv6 DNS in the interface config.

Even though the PDP context is IPv4-only, wwand still logs:

```text
15:10:55 interface fm350: ipv4 config: 10.165.215.12/32 gw - dns [10.46.50.50 10.45.50.50]
15:10:55 interface fm350: ipv6 dns: [2402:5680:840:1:21:0:0:5050] (no static v6 address — host v6 via RA/SLAAC)
```

And on XL with the same setting:

```text
15:16:58 interface fm350: ipv6 dns: [2400:9800:2:2:0:0:0:245 2400:9800:2:2:0:0:0:246]
```

This feeds into /tmp/resolv.conf.d/resolv.conf.auto. On Smartfren, the IPv6 DNS has no route (the network doesn't provide IPv6). The resolver tries it first, stalls until timeout, then falls back. Result: on Smartfren IPv4-only, ping <dns-ip> works but ping <domain> fails because resolution is stuck on the dead IPv6 upstream. On XL the IPv6 path works, so it's invisible — but the IPv6 DNS should not be reported at all when the PDP type is ipv4.

2. fm350_6 still comes up with pdp_type 'ipv4'.

On reconnecting to XL with the IPv4-only setting, fm350_6 was brought up anyway:

```text
15:17:31 netifd: Interface 'fm350_6' is now up
```

No ensuring the dynamic dhcpv6 subinterface line precedes it in this session, so netifd is re-enabling a leftover fm350_6. If the PDP is IPv4-only, that subinterface should never exist. This also re-injects the IPv6 DNS into the resolver via DHCPv6, undoing the fix for issue #1.


Suggested directions:

When pdp_type == 'ipv4', suppress the ipv6 dns line entirely — don't write it to resolv.conf.auto.

When pdp_type == 'ipv4', don't create or bring up fm350_6 even if a previous session left it configured — tear it down on transition.



the full log provides below

[wwand-switch-test-22-09-pt1.log](https://github.com/user-attachments/files/32505700/wwand-switch-test-22-09-pt1.log)

**Comment by ddimension** [comment]
Both confirmed, both fixed on `main`, and they are two separate bugs that happen
to feed each other. Thank you for the log — the timestamps are what made it
possible to take the two apart instead of guessing which one caused which.

## 1. The IPv6 DNS on an IPv4 PDP

Your reading is exactly right. From your log:

```
15:10:50  attach context 1: apn "smartfren4g" (configured), pdp ipv4
15:10:50  at: AT+CGDCONT=1,"IP","smartfren4g" ok
15:10:55  interface fm350: connecting cid 1: apn "smartfren4g", pdp-type ipv4
15:10:55  interface fm350: ipv4 config: 10.165.215.12/32 gw - dns [10.46.50.50 10.45.50.50]
15:10:55  interface fm350: ipv6 dns: [2402:5680:840:1:21:0:0:5050]
```

wwand asked for a v4-only context, the modem gave it one, and wwand then handed
netifd a v6 resolver for a link with no v6 route.

The AT backend builds its settings by reading the context back with
`CGCONTRDP` — and it did that without ever consulting the PDP type. Your modem
carried `IPV4V6` a minute earlier and goes on answering with the v6 DNS it was
given then. So the suppression you suggest is the fix, and it is now in: the v6
half is not assembled at all when the effective type is `ipv4`.

Worth saying which backends this could ever have affected, because it is only
one. QMI builds clients for the requested families only, so a v4-only context
has no v6 client to report anything. MBIM sends the type in the CONNECT itself.
The AT path is the one that asks the modem what it has rather than being told,
and that is precisely where a stale opposite family survives a change.

## 2. `fm350_6` coming back

Also right, and the mechanism is slightly worse than "a leftover". It is not
netifd re-enabling something stale — it is wwand's own section, still on disk,
doing exactly what it was written to do.

When the context was dual-stack, wwand created `config interface 'fm350_6'`
with `option auto '1'` and **deliberately did not delete it**, so that it stays
visible and editable in LuCI. On switching to `ipv4` the daemon stopped
*ensuring* it — and stopped there. netifd, which has no idea why, goes on
starting the section it finds at every reload. Which is how your fix from part 1
gets undone: odhcp6c comes up and puts the v6 resolver back over DHCPv6.

So there is now a counterpart. An IPv4-only connect parks the section
(`option auto '0'`) and takes it down; a later v6-capable connect un-parks it.
Two details you may care about as someone who switches profiles a lot:

- A `wwand_parked` marker records that **wwand** was the one that switched it
  off. If you disable that subinterface yourself, it has no marker and wwand
  will not turn it back on behind your back.
- The down is issued even when the section already reads `auto 0`, because that
  option is boot policy and not proof of what is running — an `ifup fm350_6` by
  hand would otherwise sit there unnoticed.

A review pass also found that a v6 arming already in flight could outlive the
switch and put the subinterface straight back a second later. That window is
closed too; it would have been intermittent and maddening to report.

## What I did not do

I have not closed this. The fix is host-tested with counterproofs, but your
hardware is the only place this sequence exists — four subscriptions through
one interface, two of them with an IPv6 the network does not really carry. When
it reaches the feed, the thing to watch is a switch back to XL with
`pdp_type 'ipv4'` still set: `fm350_6` should stay down, and
`/tmp/resolv.conf.d/resolv.conf.auto` should carry no `nameserver 2400:...`
line at all.

And a question, since you are the only person who can answer it: on XL with
IPv4-only set, do you actually *want* the v6 gone, or were you only using it to
dodge Smartfren? If it is the latter, `pdp_type` on the `wwand_sim` section for
the Smartfren ICCID does it per subscription instead of per interface — the
other three keep their dual stack and you stop having to remember to change it
back.

**Comment by xsetiadi** [comment]
Thanks — that's a much clearer mechanism than "leftover", and the wwand_parked marker is the kind of detail that matters when a profile gets switched from more than one direction.

On your question: I was using IPv4-only to dodge Smartfren, not because I want v6 gone on XL. The ideal end state for me is:

 - XL eSIM / physical XL → ipv4v6 (IPv6 works, keep it)

 - Smartfren eSIM → ipv4 (no IPv6 service from the network)

 - IM3 eSIM → ipv4v6 (works fine as-is)

Worth noting that IM3 is not v4-only in practice — it connected cleanly on ipv4v6 during my tests. So the carrier set isn't "all Indonesian carriers are v6-less", it's specifically Smartfren. If Smartfren eventually rolls out working IPv6 (they provision the DNS already, so it may be on their roadmap), that SIM would go back to ipv4v6 too. The per-SIM knob is more about giving each subscription the setting that matches its actual network than about permanently downgrading anything.

Looking longer-term: IPv6 is where mobile networks are heading regardless — the carriers that already run it are the ones with mature cores, and the rest will follow as their infrastructure catches up. In Smartfren's case specifically, the XLSmart merger is a plausible path: they now sit under one operator with a working IPv6 core on the XL side, and core-network integration is exactly where the two brands would eventually converge. No timeline and I'm not banking on it — packet core migrations take years, not quarters — but "Smartfren stays v4-only forever" doesn't seem like the safe assumption either. When their APN starts answering DHCPv6 for real, that SIM goes straight back to ipv4v6 in my config

Practical note on the feature itself: I don't switch eSIMs often in daily use — the switching in my logs was bug testing, not routine. So a per-SIM pdp_type would be used maybe a handful of times a year, not weekly. That means my appetite for it depends on the cost:

 - If it lands cleanly with the marker logic and the v6-orchestration gate you described, and doesn't introduce new failure modes in the switching path, I'm happy to test it and use it.

 - If it turns into a new source of edge cases — parked sections not un-parking, or v6 arming racing the switch, or anything that requires more rounds of tinkering  — it's honestly not worth the time. I'd rather keep ipv4v6 global and just live with Smartfren having no IPv6 until their network fixes itself.

in the future

Either way, no pressure from me on timing. The two bugs you just fixed are what actually mattered — the DNS one was the reason "ping DNS works but ping domain fails" was invisible on my side, and the fm350_6 re-arm was the reason my IPv4-only workaround kept getting undone. Those being gone is a real improvement whether or not per-SIM pdp_type ever lands.

Will test when it reaches the feed. The specific thing I'll watch, as you flagged: switch back to XL with pdp_type 'ipv4' still set, and confirm fm350_6 stays down and /tmp/resolv.conf.d/resolv.conf.auto has no nameserver 2400:... line.

**Comment by ddimension** [comment]
Short answer, because it changes your cost calculation entirely: **per-SIM
`pdp_type` is not a proposal. It is in the build you are running.**

`wwand 1.6.7_p64` pins `b1b5c5f`, which put `pdp_type` on the `wwand_sim`
section. You can write your three-line end state today:

```
config wwand_sim
	option iccid '8962112181029221344'   # XL
	option pdp_type 'ipv4v6'

config wwand_sim
	option iccid '89620940251000135468'  # Smartfren
	option pdp_type 'ipv4'

config wwand_sim
	option iccid '<IM3>'
	option pdp_type 'ipv4v6'
```

and drop `pdp_type` from the interface entirely — the per-SIM entry is more
specific and wins. The interface then carries the connection, the cards carry
their own family, and you stop having to remember to change anything when you
switch. Nothing else is needed; the resolution runs through the same path for
all three backends.

So the trade-off you were weighing does not apply: there is no new switching
machinery to introduce edge cases, because the switching machinery is the one
you have already been testing all week. What tonight's two fixes added on top
is that the v4-only case now behaves — no v6 resolver, and the subinterface
stays parked.

## On your IM3-versus-Smartfren observation

That is a sharper reading than mine and I think you are right: the stall is the
bogus v6 DNS, not the absent IPv6. IM3 hands back only v4 DNS in `CGCONTRDP`,
so nothing gets written that cannot be reached; Smartfren hands back a v6
server with no route to it.

It is worth saying why wwand cannot simply refuse the v6 DNS in general, which
would be the tidier fix. On this datapath the v6 address does not come from the
PDP context at all — it arrives by RA on the parent device, and the DNS-only
answer is the *normal* shape for a working dual-stack link. Refusing it would
break the case it exists for. The distinction "this v6 DNS has no route" is not
knowable when the settings are built; it is only knowable later, by trying.
`pdp_type` per card is the lever that expresses it, which is why it is the
answer rather than a workaround.

If Smartfren's core does catch up — your XLSmart reasoning is plausible and I
have no better crystal ball — that one line goes back to `ipv4v6` and nothing
else changes.

## Still open

Not closing this until you have run your own check on the packaged build:
switch back to XL with the IPv4-only setting still in place, and confirm
`fm350_6` stays down and `resolv.conf.auto` carries no `nameserver 2400:…`.
That is your test, not mine, and it is the one that decides whether this is
actually finished.

**Comment by xsetiadi** [comment]
Tested the per-SIM pdp_type today on 1.6.7_p64-r1. Result is partial:

What works: the per-SIM override is honored. After switching to the XL eSIM:

```text
11:58:47 modem wwmodem0: SIM 8962112181029221344 matched a configured wwand_sim (per-SIM pin/apn)
11:58:47 modem wwmodem0: attach context 1: apn "internet" (configured), pdp ipv4
11:58:47 modem wwmodem0: at: AT+CGDCONT=1,"IP","internet" ok
```

pdp ipv4 and the modem context is IP-only.

What doesn't work: the two v4-only follow-up fixes you described — the v6 resolver suppression and the fm350_6 parking — are not present in p64:

```text
11:58:51 interface fm350: ipv4 config: 10.143.156.239/32 gw - dns [112.215.198.248 112.215.198.254] mtu null
11:58:51 interface fm350: ipv6 dns: [2400:9800:2:2:0:0:0:245 2400:9800:2:2:0:0:0:246] (no static v6 address — host v6 via RA/SLAAC)
11:58:51 netifd: Interface 'fm350_6' is enabled
11:58:51 netifd: Interface 'fm350_6' is setting up now
11:59:04 netifd: Interface 'fm350_6' is now up
```

The ipv6 dns line still appears, and fm350_6 still comes up despite pdp ipv4.

Is p64 supposed to have both fixes, or are they in a later commit that hasn't hit the feed yet? If they're supposed to be in p64, then there's a real bug — the per-SIM override is firing, but the two follow-up behaviors aren't triggering. If they're in a later build, I'll wait for it before running the final acceptance test.

Either way, the per-SIM feature itself is confirmed working. That's a big step forward.

here the log

[wwand-switch-test-23-09-pt1.log](https://github.com/user-attachments/files/32547677/wwand-switch-test-23-09-pt1.log)

**Comment by ddimension** [comment]
No bug. They are in a later commit, and I said something wrong that sent you
looking for them — sorry about that, it cost you a test run.

I have been writing "fixed on main" in these replies. That was imprecise to the
point of being untrue: the commits are made but not pushed. Published `main` is
`b1b5c5f`, which is exactly what `1.6.7_p64` pins — so the branch you can see
and the build you are running are the same code, and neither contains the two
follow-up fixes.

Concretely:

| | commit | in p64? |
|---|---|---|
| per-SIM `pdp_type` | `b1b5c5f` | **yes** — it is the pin |
| v6 resolver suppressed on an ipv4 PDP | `26fea7e` | no |
| `fm350_6` parked on an ipv4 PDP | `26fea7e` | no |

So your two observations are exactly right and exactly expected:

```
11:58:47  attach context 1: apn "internet" (configured), pdp ipv4     <- b1b5c5f working
11:58:51  interface fm350: ipv6 dns: [2400:9800:2:2::245 …]           <- 26fea7e not in this build
11:58:51  netifd: Interface 'fm350_6' is enabled                      <- likewise
```

The per-SIM override firing while the follow-ups do not is not a contradiction
between them; it is one commit present and another absent.

Thank you for testing the half that is there, and for asking the question in
the form you did rather than assuming a bug — "is this supposed to be in p64"
is what made this quick to answer. Wait for the next feed build before the
acceptance test; there is nothing to learn from running it against p64.

And to be exact about what the acceptance test will be, since you named it
yourself last time: switch back to XL with `pdp_type 'ipv4'` still set, then
confirm `fm350_6` stays down and `/tmp/resolv.conf.d/resolv.conf.auto` carries
no `nameserver 2400:…` line.

**Comment by xsetiadi** [comment]
Confirmed the current binaries contain the fix — built at 02:40, tested at 09:37, and both symbols are present:

```text
$ grep -rl "wwand_parked" /usr/share/ucode/wwand/
/usr/share/ucode/wwand/deps.uc
$ grep -rl "retire_wan6" /usr/share/ucode/wwand/
/usr/share/ucode/wwand/daemon.uc
/usr/share/ucode/wwand/deps.uc
```
So 26fea7e is in the build I'm running, and neither half is firing. Fresh test just now: physical SIM → IM3 → XL eSIM. XL eSIM is pdp_type='ipv4'.

Half 1 — context_ncm v6 suppression. The ipv6 dns: line still appears:

```text
$ cat /tmp/resolv.conf.d/resolv.conf.auto
# Interface fm350
nameserver 112.215.198.248
nameserver 112.215.198.254
nameserver 2400:9800:2:2::245
nameserver 2400:9800:2:2::246
```
2400:... is XL's v6 DNS. On pdp ipv4 these should not be published.

Half 2 — retire_wan6 parking.

```text
$ ifstatus fm350_6
{
    "up": false,
    "pending": true,
    "available": true,
    "autostart": true,
    "dynamic": false,
    "proto": "dhcpv6",
    "device": "wwand0",
    "data": { "zone": "wan" }
}
```
autostart: true means auto 0 was not written. pending: true means netifd is actively bringing it up, not parked. No wwand_parked marker would be visible in ifstatus output, but no park message appears in the debug log either.

Questions:

1. Both commits landed before my build — 26fea7e for the v6 resolver + subinterface parking, and 8eb3230 for the daemon's response to a changed subscription. Could the 8eb3230 change be interfering with retire_wan6's trigger? Both touch the daemon's state machine, and if the subscription-change path is now preempting the family-change path, that would explain the fix not firing.

2. Is the PDP-type check in context_ncm's build_settings reading the configured value (pdp_type from the interface or wwand_sim), or the modem's CGCONTRDP reply? On this FM350-GL, AT+CGDCONT? returns 1,"IP","internet" when pdp ipv4, but the CGCONTRDP=1 reply still carries the v6 DNS field from the earlier IPV4V6 context. If the check reads from the modem's live answer rather than the config, this modem may be returning something the condition doesn't match.

3. ifstatus fm350_6 shows autostart: true, pending: true — not the parked state (auto 0, pending: false). No wwand_parked marker visible in the interface state. Is the marker stored somewhere outside ifstatus output, or would its absence here mean retire_wan6 was never entered?

**Comment by ddimension** [comment]
Your log answers all three, and it also shows that my instructions for checking
the build were wrong. Taking them in order.

## 2 — config or the modem's reply? The config, always

`effective_pdp()` is `conn_cfg(ctx, 'pdp_type')`: the `wwand_sim` entry for the
active ICCID first, the interface option second. It never looks at CGCONTRDP. So
your FM350's habit of answering with the old context's v6 DNS cannot reach the
decision — which is the whole point of the fix.

## 3 — the marker is in uci, not in ifstatus

`wwand_parked` is a uci option in `/etc/config/network`. `ifstatus` reports netifd
runtime state and never shows it. `uci show network.fm350_6` does. Your reading of
`autostart: true` is right though: that means `auto 0` was not written.

## 1 — no, 8eb3230 cannot preempt it

It adds `modem_sim_refresh` and touches `reconnect.uc` / `esim_bridge.uc`. It does
not modify the connected handler, where `retire_wan6` and `ensure_wan6` sit side
by side on complementary conditions. A reconnect still arrives at that same
handler.

## What your log actually proves

```
09:24:42  interface fm350: connecting cid 1: apn "internet", pdp-type ipv4
09:24:42  interface fm350: ipv4 config: 10.153.14.191/32 ...
09:24:42  interface fm350: ipv6 dns: [2400:9800:2:2::245 ...]
```

The dial says **ipv4** — so `conn_cfg` resolved your per-SIM override correctly —
and one second later the v6 half is published anyway. Those two numbers come from
the same function on the same object. **They cannot disagree inside one build.**

So the v6 suppression is not in the `context_ncm.uc` your daemon is running, even
though `deps.uc` and `daemon.uc` from the same commit are.

**And that is my fault, not a flaw in your check.** `wwand_parked` and
`retire_wan6` are in deps.uc and daemon.uc. The v6 suppression is in
context_ncm.uc and added **no new string whatsoever** — it is a condition. There
was nothing there to grep for, and I told you to grep. A present fix and an
absent one looked identical from outside, which is a bad way to ship a fix and it
is now fixed:

- `ipv6 half suppressed: the PDP is ipv4, but the modem still reports dns [...]
  from an earlier context` — printed whenever it actually suppresses something.
- `retire_wan6` now prints the shape it found against the shape it expects, which
  is exactly the thing `ifstatus` cannot show you.

From the next build the log states which of the two happened, and you never have
to grep for a condition again.

## Half 2 — one command decides it

```sh
uci show network.fm350_6
```

`retire_wan6` refuses, deliberately and silently, any `<parent>_6` section that is
not the shape wwand writes: `proto dhcpv6` (or `dhcpv6c`) **and** `device
'@fm350'`. That rule exists so wwand never touches a section you wrote yourself.
Your `ifstatus` shows `"device": "wwand0"` — but netifd resolves `@fm350` to
`wwand0`, so that output is consistent with either, and only uci distinguishes
them. If your section carries a literal `wwand0` (or an `ifname` instead of a
`device`), retire is declining by design, and from the next build it will say so.

## What I need, when convenient

1. `uci show network.fm350_6`
2. the exact package version: `apk info wwand wwand-ncm | head -20`
3. `ls -la /usr/share/ucode/wwand/context_ncm.uc` — and, if you ever deployed by
   hand over a package install, `find / -name 'context_ncm*' 2>/dev/null`

Point 3 because a partial deploy is the one explanation that fits everything: the
daemon loads these modules lazily, so a tree replaced under a running daemon
mixes old and new in one process. wwand's own notes warn about exactly that, and
the symptom is precisely what you have — two halves of one commit behaving
differently.

## What was missing on my side

The test suite covered `pdp_type 'ipv4'` on the **interface**, and covered the
per-SIM override reaching CGDCONT. It never covered the two **together** — which
is the only configuration you run: dual-stack interface, `ipv4` per eSIM profile.
That combination is now a test, and it passes on the current tree. Without it I
could not honestly have told you the code is right, so thank you for the log; it
found a hole in my coverage as well as in my instructions.

Staying open. And the full test you ran — five switches with a clean log — is
worth more than the three I asked for; I appreciate the trouble.

**Comment by xsetiadi** [comment]
Confirmed the reverse direction on 1.6.8_p5-r1. Test 1 (pdp ipv4, parked) passes cleanly. Test 2 (pdp ipv4v6, un-parked) passes only after a daemon restart — not after a SIM toggle.

Setup: wwand_sim[1].pdp_type='ipv4v6' committed in UCI.

Case A — SIM toggle, no daemon restart:

```text
02:41:44 sim reapply: iccid 8962112181029221344 (matched a configured wwand_sim)
02:41:44 interface fm350: the SIM changed under it — dropping the session so it re-dials on the new subscription
02:41:44 interface fm350: connecting cid 1: apn "internet", pdp-type ipv4      ← stale
02:41:46 connecting cid 1: apn "internet", pdp-type ipv4
02:41:50 connecting cid 1: apn "internet", pdp-type ipv4
```

8eb3230 fires correctly, tears down the session, re-dials — but with the pre-change pdp_type. fm350_6 stays parked with the marker intact, v6 DNS stays suppressed.

Case B — /etc/init.d/wwand restart, no SIM toggle:

```text
02:45:48 connecting cid 1: apn "internet", pdp-type ipv4v6                     ← correct

$ ifstatus fm350_6
{ "up": true, "pending": false, "autostart": true, "uptime": 71, ... }

$ uci show network.fm350_6
network.fm350_6.auto='1'                ← no wwand_parked marker

$ cat /tmp/resolv.conf.d/resolv.conf.auto
# Interface fm350
nameserver 112.215.198.248
nameserver 112.215.198.254
nameserver 2400:9800:2:2::245
nameserver 2400:9800:2:2::246
# Interface fm350_6
nameserver 2400:9800:2:2::245
nameserver 2400:9800:2:2::246
```

Round-trip is correct — ensure_wan6 un-parked, auto 1, v6 DNS restored.

The gap: the resolved per-SIM pdp_type is cached in the daemon's modem context and not invalidated by sim_refresh. 8eb3230 catches the subscription change and forces a redial, but the redial resolves pdp_type against the cached value from the previous read. Only a daemon restart rebuilds it. Same effect would hit any uci commit on wwand_sim while the daemon is running — including editing pdp_type from LuCI.

Question: on a sim_refresh, is the daemon supposed to rebuild the resolved wwand_sim context before the redial, or is the redial expected to reuse the previous resolve?

your three checks:

1. uci show network.fm350_6 (current, un-parked):

```text
network.fm350_6=interface
network.fm350_6.proto='dhcpv6'
network.fm350_6.device='@fm350'
network.fm350_6.auto='1'
network.fm350_6.zone='wan'
network.fm350_6.extendprefix='1'
```
2. Package version:

```text
wwand-1.6.8_p5-r1
wwand-ncm-1.6.8_p5-r1
```

3. context_ncm.uc on disk:

```text
$ ls -la /usr/share/ucode/wwand/context_ncm.uc
-rw-r--r--    1 root     root         37137 Jan  1  1970 /usr/share/ucode/wwand/context_ncm.uc

$ find / -name 'context_ncm*' 2>/dev/null
/overlay/upper/usr/share/ucode/wwand/context_ncm.uc
/usr/share/ucode/wwand/context_ncm.uc

$ ls -lai /overlay/upper/usr/share/ucode/wwand/context_ncm.uc /usr/share/ucode/wwand/context_ncm.uc
3102 -rw-r--r-- 1 root root 37137 Jan 1 1970 /overlay/upper/usr/share/ucode/wwand/context_ncm.uc
3102 -rw-r--r-- 1 root root 37137 Jan  1 1970 /usr/share/ucode/wwand/context_ncm.uc

$ md5sum /overlay/upper/usr/share/ucode/wwand/context_ncm.uc /usr/share/ucode/wwand/context_ncm.uc
172e3901521a34a59977e02d5b9a4037  /overlay/upper/usr/share/ucode/wwand/context_ncm.uc
172e3901521a34a59977e02d5b9a4037  /usr/share/ucode/wwand/context_ncm.uc
```

Same inode, same md5 — the two paths are one file. Partial-deploy theory doesn't fit.

Full log attached.

[wwand-switch-test-25-09-pt3.log](https://github.com/user-attachments/files/32625906/wwand-switch-test-25-09-pt3.log)
[wwand-switch-test-25-09-pt2.log](https://github.com/user-attachments/files/32625907/wwand-switch-test-25-09-pt2.log)
[wwand-switch-test-25-09-pt1.log](https://github.com/user-attachments/files/32625908/wwand-switch-test-25-09-pt1.log)

**Comment by ddimension** [comment]
Thank you. That answers more than the question you asked.

**The partial-deploy theory is withdrawn.** Same inode, same md5, and test 1
passes cleanly on p5. It was my guess, and your measurement rules it out.

**Case B works as intended.** A restart re-parses the config, ensure_wan6
un-parks the section, v6 DNS comes back. That confirms the round trip.

**Case A: the re-match happens, but against the config the daemon last
loaded.** To your question: on every SIM change wwand does rebuild the resolved
per-SIM entry, in `modem_common.uc:554` (`match_sim_override(self.config.sims,
iccid, imsi)`). It does not cache a previous result. What it matches against is
the configuration the daemon last *loaded*, and a `uci commit` on its own does
not reach any running OpenWrt service. Services pick up config through the
reload trigger. For wwand that trigger is on `network` (`files/wwand.init:99`),
and procd fires it for `reload_config` or LuCI's Save & Apply, not for a bare
commit.

Your logs show that no reload happened in Case A. All three files are the same
daemon, PID 1809 throughout. The modem identification line (`ncm modem
FM350-GL …, imei …`) appears once, at 02:06 in pt1, and never in pt3 (02:40
onward). So the modem was not rebuilt between your commit and the toggle, which
is what a reload would have done.

A reload **would** have rebuilt it. Each `wwand_sim` entry that matches a modem
is part of that modem's config signature (`config.uc:1095-1101` attaches them),
and the reload diff bounces any modem whose signature changed. So a changed
`pdp_type` on a SIM entry takes effect on the next reload.

About LuCI: by the same path, Save & Apply should work. I have not tested that
exact edit on hardware, so I would rather you confirm it than take my word.
Either of these should behave like your Case B, without a daemon restart:

```sh
uci set network.<your wwand_sim section>.pdp_type='ipv4v6'
uci commit network
reload_config          # this is the step Case A was missing
```

or change `pdp_type` on the SIM in LuCI and press Save & Apply. Then toggle the
SIM and check that the dial says `pdp-type ipv4v6`.

If it still dials with the old type after a reload, then there is a real bug
and I will want the log. Leaving this open until you have tried it.
